PokerStars Hand #259458311449: Tournament #3969056830, €0.93+€0.07 EUR Hold'em No Limit - Level I (10/20) - 2026/01/25 19:08:01 CET [2026/01/25 13:08:01 ET]
Table '3969056830 1' 3-max Seat #1 is the button
Seat 1: mabeal1 (500 in chips) 
Seat 2: 8-KALVER-8 (500 in chips) 
Seat 3: pulutant (500 in chips) 
8-KALVER-8: posts small blind 10
pulutant: posts big blind 20
*** HOLE CARDS ***
Dealt to mabeal1 [4c Jd]
mabeal1: folds 
8-KALVER-8: raises 20 to 40
pulutant: calls 20
*** FLOP *** [6c Ac Tc]
8-KALVER-8: bets 40
pulutant: calls 40
*** TURN *** [6c Ac Tc] [Kc]
8-KALVER-8: checks 
pulutant: checks 
*** RIVER *** [6c Ac Tc Kc] [8d]
8-KALVER-8: bets 160
pulutant: folds 
Uncalled bet (160) returned to 8-KALVER-8
8-KALVER-8 collected 160 from pot
*** SUMMARY ***
Total pot 160 | Rake 0 
Board [6c Ac Tc Kc 8d]
Seat 1: mabeal1 (button) folded before Flop (didn't bet)
Seat 2: 8-KALVER-8 (small blind) collected (160)
Seat 3: pulutant (big blind) folded on the River



PokerStars Hand #259458319534: Tournament #3969056830, €0.93+€0.07 EUR Hold'em No Limit - Level I (10/20) - 2026/01/25 19:08:31 CET [2026/01/25 13:08:31 ET]
Table '3969056830 1' 3-max Seat #2 is the button
Seat 1: mabeal1 (500 in chips) 
Seat 2: 8-KALVER-8 (580 in chips) 
Seat 3: pulutant (420 in chips) 
pulutant: posts small blind 10
mabeal1: posts big blind 20
*** HOLE CARDS ***
Dealt to mabeal1 [5d 6d]
8-KALVER-8: folds 
pulutant: calls 10
mabeal1: checks 
*** FLOP *** [9s Qc 8c]
pulutant: checks 
mabeal1: checks 
*** TURN *** [9s Qc 8c] [7d]
pulutant: checks 
mabeal1: bets 30
pulutant: calls 30
*** RIVER *** [9s Qc 8c 7d] [2d]
pulutant: checks 
mabeal1: bets 100
pulutant: folds 
Uncalled bet (100) returned to mabeal1
mabeal1 collected 100 from pot
mabeal1: doesn't show hand 
*** SUMMARY ***
Total pot 100 | Rake 0 
Board [9s Qc 8c 7d 2d]
Seat 1: mabeal1 (big blind) collected (100)
Seat 2: 8-KALVER-8 (button) folded before Flop (didn't bet)
Seat 3: pulutant (small blind) folded on the River



PokerStars Hand #259458326257: Tournament #3969056830, €0.93+€0.07 EUR Hold'em No Limit - Level I (10/20) - 2026/01/25 19:08:57 CET [2026/01/25 13:08:57 ET]
Table '3969056830 1' 3-max Seat #3 is the button
Seat 1: mabeal1 (550 in chips) 
Seat 2: 8-KALVER-8 (580 in chips) 
Seat 3: pulutant (370 in chips) 
mabeal1: posts small blind 10
8-KALVER-8: posts big blind 20
*** HOLE CARDS ***
Dealt to mabeal1 [6h 7h]
pulutant: calls 20
mabeal1: calls 10
8-KALVER-8: checks 
*** FLOP *** [4h 4s Kh]
mabeal1: checks 
8-KALVER-8: checks 
pulutant: checks 
*** TURN *** [4h 4s Kh] [Jh]
mabeal1: bets 60
8-KALVER-8: folds 
pulutant: calls 60
*** RIVER *** [4h 4s Kh Jh] [3d]
mabeal1: bets 180
pulutant: folds 
Uncalled bet (180) returned to mabeal1
mabeal1 collected 180 from pot
mabeal1: doesn't show hand 
*** SUMMARY ***
Total pot 180 | Rake 0 
Board [4h 4s Kh Jh 3d]
Seat 1: mabeal1 (small blind) collected (180)
Seat 2: 8-KALVER-8 (big blind) folded on the Turn
Seat 3: pulutant (button) folded on the River



PokerStars Hand #259458337770: Tournament #3969056830, €0.93+€0.07 EUR Hold'em No Limit - Level I (10/20) - 2026/01/25 19:09:40 CET [2026/01/25 13:09:40 ET]
Table '3969056830 1' 3-max Seat #1 is the button
Seat 1: mabeal1 (650 in chips) 
Seat 2: 8-KALVER-8 (560 in chips) 
Seat 3: pulutant (290 in chips) 
8-KALVER-8: posts small blind 10
pulutant: posts big blind 20
*** HOLE CARDS ***
Dealt to mabeal1 [9d 5h]
mabeal1: folds 
8-KALVER-8: raises 20 to 40
pulutant: calls 20
*** FLOP *** [7h Qs 6c]
8-KALVER-8: checks 
pulutant: checks 
*** TURN *** [7h Qs 6c] [Ts]
8-KALVER-8: bets 40
pulutant: calls 40
*** RIVER *** [7h Qs 6c Ts] [6s]
8-KALVER-8: bets 80
pulutant: calls 80
*** SHOW DOWN ***
8-KALVER-8: shows [7d Qd] (two pair, Queens and Sevens)
pulutant: mucks hand 
8-KALVER-8 collected 320 from pot
*** SUMMARY ***
Total pot 320 | Rake 0 
Board [7h Qs 6c Ts 6s]
Seat 1: mabeal1 (button) folded before Flop (didn't bet)
Seat 2: 8-KALVER-8 (small blind) showed [7d Qd] and won (320) with two pair, Queens and Sevens
Seat 3: pulutant (big blind) mucked [7s Jh]



PokerStars Hand #259458344793: Tournament #3969056830, €0.93+€0.07 EUR Hold'em No Limit - Level II (15/30) - 2026/01/25 19:10:06 CET [2026/01/25 13:10:06 ET]
Table '3969056830 1' 3-max Seat #2 is the button
Seat 1: mabeal1 (650 in chips) 
Seat 2: 8-KALVER-8 (720 in chips) 
Seat 3: pulutant (130 in chips) 
pulutant: posts small blind 15
mabeal1: posts big blind 30
*** HOLE CARDS ***
Dealt to mabeal1 [Qd Qc]
8-KALVER-8: raises 30 to 60
pulutant: folds 
mabeal1: raises 120 to 180
8-KALVER-8: raises 540 to 720 and is all-in
mabeal1: calls 470 and is all-in
Uncalled bet (70) returned to 8-KALVER-8
*** FLOP *** [5c 3c 6s]
*** TURN *** [5c 3c 6s] [Th]
*** RIVER *** [5c 3c 6s Th] [3h]
*** SHOW DOWN ***
mabeal1: shows [Qd Qc] (two pair, Queens and Threes)
8-KALVER-8: shows [2h Ah] (a pair of Threes)
mabeal1 collected 1315 from pot
*** SUMMARY ***
Total pot 1315 | Rake 0 
Board [5c 3c 6s Th 3h]
Seat 1: mabeal1 (big blind) showed [Qd Qc] and won (1315) with two pair, Queens and Threes
Seat 2: 8-KALVER-8 (button) showed [2h Ah] and lost with a pair of Threes
Seat 3: pulutant (small blind) folded before Flop



PokerStars Hand #259458352209: Tournament #3969056830, €0.93+€0.07 EUR Hold'em No Limit - Level II (15/30) - 2026/01/25 19:10:34 CET [2026/01/25 13:10:34 ET]
Table '3969056830 1' 3-max Seat #3 is the button
Seat 1: mabeal1 (1315 in chips) 
Seat 2: 8-KALVER-8 (70 in chips) 
Seat 3: pulutant (115 in chips) 
mabeal1: posts small blind 15
8-KALVER-8: posts big blind 30
*** HOLE CARDS ***
Dealt to mabeal1 [Tc Qh]
pulutant: calls 30
mabeal1: raises 120 to 150
8-KALVER-8: folds 
pulutant: calls 85 and is all-in
Uncalled bet (35) returned to mabeal1
*** FLOP *** [Ac 9h 2d]
*** TURN *** [Ac 9h 2d] [Kh]
*** RIVER *** [Ac 9h 2d Kh] [Ah]
*** SHOW DOWN ***
mabeal1: shows [Tc Qh] (a pair of Aces)
pulutant: shows [Ks 4d] (two pair, Aces and Kings)
pulutant collected 260 from pot
*** SUMMARY ***
Total pot 260 | Rake 0 
Board [Ac 9h 2d Kh Ah]
Seat 1: mabeal1 (small blind) showed [Tc Qh] and lost with a pair of Aces
Seat 2: 8-KALVER-8 (big blind) folded before Flop
Seat 3: pulutant (button) showed [Ks 4d] and won (260) with two pair, Aces and Kings



PokerStars Hand #259458357547: Tournament #3969056830, €0.93+€0.07 EUR Hold'em No Limit - Level II (15/30) - 2026/01/25 19:10:54 CET [2026/01/25 13:10:54 ET]
Table '3969056830 1' 3-max Seat #1 is the button
Seat 1: mabeal1 (1200 in chips) 
Seat 2: 8-KALVER-8 (40 in chips) 
Seat 3: pulutant (260 in chips) 
8-KALVER-8: posts small blind 15
pulutant: posts big blind 30
*** HOLE CARDS ***
Dealt to mabeal1 [4c 3s]
mabeal1: folds 
8-KALVER-8: raises 10 to 40 and is all-in
pulutant: calls 10
*** FLOP *** [6d Jc 3d]
*** TURN *** [6d Jc 3d] [Jd]
*** RIVER *** [6d Jc 3d Jd] [9c]
*** SHOW DOWN ***
8-KALVER-8: shows [8c Td] (a pair of Jacks)
pulutant: shows [Ac Kh] (a pair of Jacks - Ace kicker)
pulutant collected 80 from pot
8-KALVER-8 finished the tournament in 3rd place
*** SUMMARY ***
Total pot 80 | Rake 0 
Board [6d Jc 3d Jd 9c]
Seat 1: mabeal1 (button) folded before Flop (didn't bet)
Seat 2: 8-KALVER-8 (small blind) showed [8c Td] and lost with a pair of Jacks
Seat 3: pulutant (big blind) showed [Ac Kh] and won (80) with a pair of Jacks



PokerStars Hand #259458362626: Tournament #3969056830, €0.93+€0.07 EUR Hold'em No Limit - Level II (15/30) - 2026/01/25 19:11:13 CET [2026/01/25 13:11:13 ET]
Table '3969056830 1' 3-max Seat #3 is the button
Seat 1: mabeal1 (1200 in chips) 
Seat 3: pulutant (300 in chips) 
pulutant: posts small blind 15
mabeal1: posts big blind 30
*** HOLE CARDS ***
Dealt to mabeal1 [5h Jh]
pulutant: calls 15
mabeal1: checks 
*** FLOP *** [3h 4d Jd]
mabeal1: checks 
pulutant: bets 60
mabeal1: calls 60
*** TURN *** [3h 4d Jd] [7c]
mabeal1: checks 
pulutant: bets 210 and is all-in
mabeal1: calls 210
*** RIVER *** [3h 4d Jd 7c] [9s]
*** SHOW DOWN ***
mabeal1: shows [5h Jh] (a pair of Jacks)
pulutant: shows [3d 2d] (a pair of Threes)
mabeal1 collected 600 from pot
pulutant finished the tournament in 2nd place
mabeal1 wins the tournament and receives €2.00 - congratulations!
*** SUMMARY ***
Total pot 600 | Rake 0 
Board [3h 4d Jd 7c 9s]
Seat 1: mabeal1 (big blind) showed [5h Jh] and won (600) with a pair of Jacks
Seat 3: pulutant (button) (small blind) showed [3d 2d] and lost with a pair of Threes



