PokerStars Hand #259396000384: Tournament #3967575094, €0.46+€0.04 EUR Hold'em No Limit - Level I (10/20) - 2026/01/20 23:33:59 CET [2026/01/20 17:33:59 ET]
Table '3967575094 1' 3-max Seat #1 is the button
Seat 1: Guilli85 (500 in chips) 
Seat 2: sevire (500 in chips) 
Seat 3: mabeal1 (500 in chips) 
sevire: posts small blind 10
mabeal1: posts big blind 20
*** HOLE CARDS ***
Dealt to mabeal1 [7h 8h]
Guilli85: calls 20
sevire: calls 10
mabeal1: raises 40 to 60
Guilli85: folds 
sevire: folds 
Uncalled bet (40) returned to mabeal1
mabeal1 collected 60 from pot
mabeal1: doesn't show hand 
*** SUMMARY ***
Total pot 60 | Rake 0 
Seat 1: Guilli85 (button) folded before Flop
Seat 2: sevire (small blind) folded before Flop
Seat 3: mabeal1 (big blind) collected (60)



PokerStars Hand #259396005703: Tournament #3967575094, €0.46+€0.04 EUR Hold'em No Limit - Level I (10/20) - 2026/01/20 23:34:22 CET [2026/01/20 17:34:22 ET]
Table '3967575094 1' 3-max Seat #2 is the button
Seat 1: Guilli85 (480 in chips) 
Seat 2: sevire (480 in chips) 
Seat 3: mabeal1 (540 in chips) 
mabeal1: posts small blind 10
Guilli85: posts big blind 20
*** HOLE CARDS ***
Dealt to mabeal1 [Th Jh]
sevire: raises 20 to 40
mabeal1: calls 30
Guilli85: calls 20
*** FLOP *** [9s 5h Kh]
mabeal1: checks 
Guilli85: checks 
sevire: bets 20
mabeal1: raises 120 to 140
Guilli85: folds 
sevire: raises 300 to 440 and is all-in
mabeal1: calls 300
*** TURN *** [9s 5h Kh] [Jd]
*** RIVER *** [9s 5h Kh Jd] [Ac]
*** SHOW DOWN ***
mabeal1: shows [Th Jh] (a pair of Jacks)
sevire: shows [As Kc] (two pair, Aces and Kings)
sevire collected 1000 from pot
*** SUMMARY ***
Total pot 1000 | Rake 0 
Board [9s 5h Kh Jd Ac]
Seat 1: Guilli85 (big blind) folded on the Flop
Seat 2: sevire (button) showed [As Kc] and won (1000) with two pair, Aces and Kings
Seat 3: mabeal1 (small blind) showed [Th Jh] and lost with a pair of Jacks



PokerStars Hand #259396020670: Tournament #3967575094, €0.46+€0.04 EUR Hold'em No Limit - Level I (10/20) - 2026/01/20 23:35:24 CET [2026/01/20 17:35:24 ET]
Table '3967575094 1' 3-max Seat #3 is the button
Seat 1: Guilli85 (440 in chips) 
Seat 2: sevire (1000 in chips) 
Seat 3: mabeal1 (60 in chips) 
Guilli85: posts small blind 10
sevire: posts big blind 20
*** HOLE CARDS ***
Dealt to mabeal1 [5c Kh]
mabeal1: raises 40 to 60 and is all-in
Guilli85: folds 
sevire: folds 
Uncalled bet (40) returned to mabeal1
mabeal1 collected 50 from pot
mabeal1: doesn't show hand 
*** SUMMARY ***
Total pot 50 | Rake 0 
Seat 1: Guilli85 (small blind) folded before Flop
Seat 2: sevire (big blind) folded before Flop
Seat 3: mabeal1 (button) collected (50)



PokerStars Hand #259396024594: Tournament #3967575094, €0.46+€0.04 EUR Hold'em No Limit - Level I (10/20) - 2026/01/20 23:35:40 CET [2026/01/20 17:35:40 ET]
Table '3967575094 1' 3-max Seat #1 is the button
Seat 1: Guilli85 (430 in chips) 
Seat 2: sevire (980 in chips) 
Seat 3: mabeal1 (90 in chips) 
sevire: posts small blind 10
mabeal1: posts big blind 20
*** HOLE CARDS ***
Dealt to mabeal1 [8h 3s]
Guilli85: calls 20
sevire: raises 60 to 80
mabeal1: folds 
Guilli85: folds 
Uncalled bet (60) returned to sevire
sevire collected 60 from pot
sevire: doesn't show hand 
*** SUMMARY ***
Total pot 60 | Rake 0 
Seat 1: Guilli85 (button) folded before Flop
Seat 2: sevire (small blind) collected (60)
Seat 3: mabeal1 (big blind) folded before Flop



PokerStars Hand #259396030474: Tournament #3967575094, €0.46+€0.04 EUR Hold'em No Limit - Level I (10/20) - 2026/01/20 23:36:05 CET [2026/01/20 17:36:05 ET]
Table '3967575094 1' 3-max Seat #2 is the button
Seat 1: Guilli85 (410 in chips) 
Seat 2: sevire (1020 in chips) 
Seat 3: mabeal1 (70 in chips) 
mabeal1: posts small blind 10
Guilli85: posts big blind 20
*** HOLE CARDS ***
Dealt to mabeal1 [8h 4d]
sevire: folds 
mabeal1: raises 50 to 70 and is all-in
Guilli85: folds 
Uncalled bet (50) returned to mabeal1
mabeal1 collected 40 from pot
mabeal1: doesn't show hand 
*** SUMMARY ***
Total pot 40 | Rake 0 
Seat 1: Guilli85 (big blind) folded before Flop
Seat 2: sevire (button) folded before Flop (didn't bet)
Seat 3: mabeal1 (small blind) collected (40)



PokerStars Hand #259396035910: Tournament #3967575094, €0.46+€0.04 EUR Hold'em No Limit - Level I (10/20) - 2026/01/20 23:36:27 CET [2026/01/20 17:36:27 ET]
Table '3967575094 1' 3-max Seat #3 is the button
Seat 1: Guilli85 (390 in chips) 
Seat 2: sevire (1020 in chips) 
Seat 3: mabeal1 (90 in chips) 
Guilli85: posts small blind 10
sevire: posts big blind 20
*** HOLE CARDS ***
Dealt to mabeal1 [4s Kh]
mabeal1: raises 70 to 90 and is all-in
Guilli85: folds 
sevire: calls 70
*** FLOP *** [Qd 3s 4h]
*** TURN *** [Qd 3s 4h] [Jd]
*** RIVER *** [Qd 3s 4h Jd] [Ad]
*** SHOW DOWN ***
sevire: shows [Th Kd] (a straight, Ten to Ace)
mabeal1: shows [4s Kh] (a pair of Fours)
sevire collected 190 from pot
mabeal1 finished the tournament in 3rd place
*** SUMMARY ***
Total pot 190 | Rake 0 
Board [Qd 3s 4h Jd Ad]
Seat 1: Guilli85 (small blind) folded before Flop
Seat 2: sevire (big blind) showed [Th Kd] and won (190) with a straight, Ten to Ace
Seat 3: mabeal1 (button) showed [4s Kh] and lost with a pair of Fours



