PokerStars Hand #259543312334: Tournament #3970994355, €0.93+€0.07 EUR Hold'em No Limit - Level I (10/20) - 2026/02/01 2:54:37 CET [2026/01/31 20:54:37 ET]
Table '3970994355 1' 3-max Seat #1 is the button
Seat 1: pescadili r (500 in chips) 
Seat 2: mabeal1 (500 in chips) 
Seat 3: javierpp95 (500 in chips) 
mabeal1: posts small blind 10
javierpp95: posts big blind 20
*** HOLE CARDS ***
Dealt to mabeal1 [4c 7s]
pescadili r: raises 20 to 40
mabeal1: folds 
javierpp95: calls 20
*** FLOP *** [2s 2c 5h]
javierpp95: checks 
pescadili r: checks 
*** TURN *** [2s 2c 5h] [8h]
javierpp95: bets 40
pescadili r: calls 40
*** RIVER *** [2s 2c 5h 8h] [Js]
javierpp95: bets 420 and is all-in
pescadili r: folds 
Uncalled bet (420) returned to javierpp95
javierpp95 collected 170 from pot
*** SUMMARY ***
Total pot 170 | Rake 0 
Board [2s 2c 5h 8h Js]
Seat 1: pescadili r (button) folded on the River
Seat 2: mabeal1 (small blind) folded before Flop
Seat 3: javierpp95 (big blind) collected (170)



PokerStars Hand #259543315602: Tournament #3970994355, €0.93+€0.07 EUR Hold'em No Limit - Level I (10/20) - 2026/02/01 2:54:59 CET [2026/01/31 20:54:59 ET]
Table '3970994355 1' 3-max Seat #2 is the button
Seat 1: pescadili r (420 in chips) 
Seat 2: mabeal1 (490 in chips) 
Seat 3: javierpp95 (590 in chips) 
javierpp95: posts small blind 10
pescadili r: posts big blind 20
*** HOLE CARDS ***
Dealt to mabeal1 [8d 6s]
mabeal1: folds 
javierpp95: calls 10
pescadili r: checks 
*** FLOP *** [4h Tc 4d]
javierpp95: checks 
pescadili r: bets 20
javierpp95: calls 20
*** TURN *** [4h Tc 4d] [Jh]
javierpp95: checks 
pescadili r: bets 20
javierpp95: folds 
Uncalled bet (20) returned to pescadili r
pescadili r collected 80 from pot
*** SUMMARY ***
Total pot 80 | Rake 0 
Board [4h Tc 4d Jh]
Seat 1: pescadili r (big blind) collected (80)
Seat 2: mabeal1 (button) folded before Flop (didn't bet)
Seat 3: javierpp95 (small blind) folded on the Turn



PokerStars Hand #259543318048: Tournament #3970994355, €0.93+€0.07 EUR Hold'em No Limit - Level I (10/20) - 2026/02/01 2:55:17 CET [2026/01/31 20:55:17 ET]
Table '3970994355 1' 3-max Seat #3 is the button
Seat 1: pescadili r (460 in chips) 
Seat 2: mabeal1 (490 in chips) 
Seat 3: javierpp95 (550 in chips) 
pescadili r: posts small blind 10
mabeal1: posts big blind 20
*** HOLE CARDS ***
Dealt to mabeal1 [2c Tc]
javierpp95: raises 40 to 60
pescadili r: calls 50
mabeal1: folds 
*** FLOP *** [4d As 2h]
pescadili r: checks 
javierpp95: checks 
*** TURN *** [4d As 2h] [7h]
pescadili r: checks 
javierpp95: bets 70
pescadili r: calls 70
*** RIVER *** [4d As 2h 7h] [6s]
pescadili r: checks 
javierpp95: bets 140
pescadili r: folds 
Uncalled bet (140) returned to javierpp95
javierpp95 collected 280 from pot
*** SUMMARY ***
Total pot 280 | Rake 0 
Board [4d As 2h 7h 6s]
Seat 1: pescadili r (small blind) folded on the River
Seat 2: mabeal1 (big blind) folded before Flop
Seat 3: javierpp95 (button) collected (280)



PokerStars Hand #259543321131: Tournament #3970994355, €0.93+€0.07 EUR Hold'em No Limit - Level I (10/20) - 2026/02/01 2:55:44 CET [2026/01/31 20:55:44 ET]
Table '3970994355 1' 3-max Seat #1 is the button
Seat 1: pescadili r (330 in chips) 
Seat 2: mabeal1 (470 in chips) 
Seat 3: javierpp95 (700 in chips) 
mabeal1: posts small blind 10
javierpp95: posts big blind 20
*** HOLE CARDS ***
Dealt to mabeal1 [9h Kc]
pescadili r: calls 20
mabeal1: calls 10
javierpp95: raises 20 to 40
pescadili r: calls 20
mabeal1: calls 20
*** FLOP *** [6h Qs 4c]
mabeal1: checks 
javierpp95: checks 
pescadili r: bets 20
mabeal1: folds 
javierpp95: calls 20
*** TURN *** [6h Qs 4c] [5c]
javierpp95: checks 
pescadili r: bets 40
javierpp95: calls 40
*** RIVER *** [6h Qs 4c 5c] [2s]
javierpp95: checks 
pescadili r: bets 20
javierpp95: raises 100 to 120
pescadili r: calls 100
*** SHOW DOWN ***
javierpp95: shows [Ac 9d] (high card Ace)
pescadili r: shows [7s Qd] (a pair of Queens)
pescadili r collected 480 from pot
*** SUMMARY ***
Total pot 480 | Rake 0 
Board [6h Qs 4c 5c 2s]
Seat 1: pescadili r (button) showed [7s Qd] and won (480) with a pair of Queens
Seat 2: mabeal1 (small blind) folded on the Flop
Seat 3: javierpp95 (big blind) showed [Ac 9d] and lost with high card Ace



PokerStars Hand #259543324357: Tournament #3970994355, €0.93+€0.07 EUR Hold'em No Limit - Level I (10/20) - 2026/02/01 2:56:13 CET [2026/01/31 20:56:13 ET]
Table '3970994355 1' 3-max Seat #2 is the button
Seat 1: pescadili r (590 in chips) 
Seat 2: mabeal1 (430 in chips) 
Seat 3: javierpp95 (480 in chips) 
javierpp95: posts small blind 10
pescadili r: posts big blind 20
*** HOLE CARDS ***
Dealt to mabeal1 [6s Ts]
mabeal1: raises 20 to 40
javierpp95: calls 30
pescadili r: raises 20 to 60
mabeal1: calls 20
javierpp95: calls 20
*** FLOP *** [Ks 4d 7s]
javierpp95: checks 
pescadili r: bets 20
mabeal1: raises 85 to 105
javierpp95: folds 
pescadili r: raises 85 to 190
mabeal1: raises 180 to 370 and is all-in
pescadili r: calls 180
*** TURN *** [Ks 4d 7s] [Kd]
*** RIVER *** [Ks 4d 7s Kd] [4s]
*** SHOW DOWN ***
pescadili r: shows [Kh Ah] (a full house, Kings full of Fours)
mabeal1: shows [6s Ts] (a flush, King high)
pescadili r collected 920 from pot
mabeal1 finished the tournament in 3rd place
*** SUMMARY ***
Total pot 920 | Rake 0 
Board [Ks 4d 7s Kd 4s]
Seat 1: pescadili r (big blind) showed [Kh Ah] and won (920) with a full house, Kings full of Fours
Seat 2: mabeal1 (button) showed [6s Ts] and lost with a flush, King high
Seat 3: javierpp95 (small blind) folded on the Flop



