PokerStars Hand #259550683473: Tournament #3971160112, €0.93+€0.07 EUR Hold'em No Limit - Level I (10/20) - 2026/02/01 18:32:41 CET [2026/02/01 12:32:41 ET]
Table '3971160112 1' 3-max Seat #1 is the button
Seat 1: mabeal1 (500 in chips) 
Seat 2: sebpanigale (500 in chips) 
Seat 3: kkkk1313 (500 in chips) 
sebpanigale: posts small blind 10
kkkk1313: posts big blind 20
*** HOLE CARDS ***
Dealt to mabeal1 [6c Kc]
mabeal1: raises 20 to 40
sebpanigale: folds 
kkkk1313: calls 20
*** FLOP *** [Ah 9d 4h]
kkkk1313: checks 
mabeal1: bets 40
kkkk1313: calls 40
*** TURN *** [Ah 9d 4h] [8h]
kkkk1313: checks 
mabeal1: checks 
*** RIVER *** [Ah 9d 4h 8h] [2c]
kkkk1313: bets 40
mabeal1: folds 
Uncalled bet (40) returned to kkkk1313
kkkk1313 collected 170 from pot
kkkk1313: doesn't show hand 
*** SUMMARY ***
Total pot 170 | Rake 0 
Board [Ah 9d 4h 8h 2c]
Seat 1: mabeal1 (button) folded on the River
Seat 2: sebpanigale (small blind) folded before Flop
Seat 3: kkkk1313 (big blind) collected (170)



PokerStars Hand #259550689591: Tournament #3971160112, €0.93+€0.07 EUR Hold'em No Limit - Level I (10/20) - 2026/02/01 18:33:03 CET [2026/02/01 12:33:03 ET]
Table '3971160112 1' 3-max Seat #2 is the button
Seat 1: mabeal1 (420 in chips) 
Seat 2: sebpanigale (490 in chips) 
Seat 3: kkkk1313 (590 in chips) 
kkkk1313: posts small blind 10
mabeal1: posts big blind 20
*** HOLE CARDS ***
Dealt to mabeal1 [Jc 5d]
sebpanigale: raises 20 to 40
kkkk1313: folds 
mabeal1: folds 
Uncalled bet (20) returned to sebpanigale
sebpanigale collected 50 from pot
sebpanigale: doesn't show hand 
*** SUMMARY ***
Total pot 50 | Rake 0 
Seat 1: mabeal1 (big blind) folded before Flop
Seat 2: sebpanigale (button) collected (50)
Seat 3: kkkk1313 (small blind) folded before Flop



PokerStars Hand #259550691842: Tournament #3971160112, €0.93+€0.07 EUR Hold'em No Limit - Level I (10/20) - 2026/02/01 18:33:12 CET [2026/02/01 12:33:12 ET]
Table '3971160112 1' 3-max Seat #3 is the button
Seat 1: mabeal1 (400 in chips) 
Seat 2: sebpanigale (520 in chips) 
Seat 3: kkkk1313 (580 in chips) 
mabeal1: posts small blind 10
sebpanigale: posts big blind 20
*** HOLE CARDS ***
Dealt to mabeal1 [9c As]
kkkk1313: folds 
mabeal1: raises 380 to 400 and is all-in
sebpanigale: folds 
Uncalled bet (380) returned to mabeal1
mabeal1 collected 40 from pot
mabeal1: doesn't show hand 
*** SUMMARY ***
Total pot 40 | Rake 0 
Seat 1: mabeal1 (small blind) collected (40)
Seat 2: sebpanigale (big blind) folded before Flop
Seat 3: kkkk1313 (button) folded before Flop (didn't bet)



PokerStars Hand #259550694159: Tournament #3971160112, €0.93+€0.07 EUR Hold'em No Limit - Level I (10/20) - 2026/02/01 18:33:21 CET [2026/02/01 12:33:21 ET]
Table '3971160112 1' 3-max Seat #1 is the button
Seat 1: mabeal1 (420 in chips) 
Seat 2: sebpanigale (500 in chips) 
Seat 3: kkkk1313 (580 in chips) 
sebpanigale: posts small blind 10
kkkk1313: posts big blind 20
*** HOLE CARDS ***
Dealt to mabeal1 [Jh Js]
mabeal1: raises 20 to 40
sebpanigale: calls 30
kkkk1313: calls 20
*** FLOP *** [Qs 7h 9d]
sebpanigale: bets 60
kkkk1313: calls 60
mabeal1: calls 60
*** TURN *** [Qs 7h 9d] [6c]
sebpanigale: bets 150
kkkk1313: calls 150
mabeal1: folds 
*** RIVER *** [Qs 7h 9d 6c] [Ah]
sebpanigale: checks 
kkkk1313: bets 120
sebpanigale: folds 
Uncalled bet (120) returned to kkkk1313
kkkk1313 collected 600 from pot
kkkk1313: doesn't show hand 
*** SUMMARY ***
Total pot 600 | Rake 0 
Board [Qs 7h 9d 6c Ah]
Seat 1: mabeal1 (button) folded on the Turn
Seat 2: sebpanigale (small blind) folded on the River
Seat 3: kkkk1313 (big blind) collected (600)



PokerStars Hand #259550704563: Tournament #3971160112, €0.93+€0.07 EUR Hold'em No Limit - Level I (10/20) - 2026/02/01 18:33:59 CET [2026/02/01 12:33:59 ET]
Table '3971160112 1' 3-max Seat #2 is the button
Seat 1: mabeal1 (320 in chips) 
Seat 2: sebpanigale (250 in chips) 
Seat 3: kkkk1313 (930 in chips) 
kkkk1313: posts small blind 10
mabeal1: posts big blind 20
*** HOLE CARDS ***
Dealt to mabeal1 [5s 4d]
sebpanigale: folds 
kkkk1313: calls 10
mabeal1: checks 
*** FLOP *** [8s 9s Ks]
kkkk1313: bets 40
mabeal1: folds 
Uncalled bet (40) returned to kkkk1313
kkkk1313 collected 40 from pot
kkkk1313: doesn't show hand 
*** SUMMARY ***
Total pot 40 | Rake 0 
Board [8s 9s Ks]
Seat 1: mabeal1 (big blind) folded on the Flop
Seat 2: sebpanigale (button) folded before Flop (didn't bet)
Seat 3: kkkk1313 (small blind) collected (40)



PokerStars Hand #259550708220: Tournament #3971160112, €0.93+€0.07 EUR Hold'em No Limit - Level I (10/20) - 2026/02/01 18:34:13 CET [2026/02/01 12:34:13 ET]
Table '3971160112 1' 3-max Seat #3 is the button
Seat 1: mabeal1 (300 in chips) 
Seat 2: sebpanigale (250 in chips) 
Seat 3: kkkk1313 (950 in chips) 
mabeal1: posts small blind 10
sebpanigale: posts big blind 20
*** HOLE CARDS ***
Dealt to mabeal1 [6c Ks]
kkkk1313: calls 20
mabeal1: calls 10
sebpanigale: checks 
*** FLOP *** [2s Qc 5s]
mabeal1: checks 
sebpanigale: bets 20
kkkk1313: calls 20
mabeal1: raises 260 to 280 and is all-in
sebpanigale: calls 210 and is all-in
kkkk1313: folds 
Uncalled bet (50) returned to mabeal1
*** TURN *** [2s Qc 5s] [Ah]
*** RIVER *** [2s Qc 5s Ah] [4c]
*** SHOW DOWN ***
mabeal1: shows [6c Ks] (high card Ace)
sebpanigale: shows [Qd 5c] (two pair, Queens and Fives)
sebpanigale collected 540 from pot
*** SUMMARY ***
Total pot 540 | Rake 0 
Board [2s Qc 5s Ah 4c]
Seat 1: mabeal1 (small blind) showed [6c Ks] and lost with high card Ace
Seat 2: sebpanigale (big blind) showed [Qd 5c] and won (540) with two pair, Queens and Fives
Seat 3: kkkk1313 (button) folded on the Flop



